{"approval":null,"benchmarks":[{"concurrency":null,"fixture_digest":null,"gate_id":"C-PERF-RUNNER","invalidation_policy":"record-and-rerun-complete-trial-set","operation":"streaming-runner","repetitions":null,"resource_limits":{"cpu_millicores":null,"disk_bytes":null,"memory_bytes":null},"runner_class":null,"tool_digests":[],"trial_retention":"all-raw-trials","warmup_runs":null},{"concurrency":null,"fixture_digest":null,"gate_id":"C-PERF-INGEST","invalidation_policy":"record-and-rerun-complete-trial-set","operation":"observation-ingest","repetitions":null,"resource_limits":{"cpu_millicores":null,"disk_bytes":null,"memory_bytes":null},"runner_class":null,"tool_digests":[],"trial_retention":"all-raw-trials","warmup_runs":null},{"concurrency":null,"fixture_digest":null,"gate_id":"C-PERF-REPORT","invalidation_policy":"record-and-rerun-complete-trial-set","operation":"report-projection","repetitions":null,"resource_limits":{"cpu_millicores":null,"disk_bytes":null,"memory_bytes":null},"runner_class":null,"tool_digests":[],"trial_retention":"all-raw-trials","warmup_runs":null},{"concurrency":null,"fixture_digest":null,"gate_id":"C-PERF-CAMPAIGN","invalidation_policy":"record-and-rerun-complete-trial-set","operation":"campaign-settlement","repetitions":null,"resource_limits":{"cpu_millicores":null,"disk_bytes":null,"memory_bytes":null},"runner_class":null,"tool_digests":[],"trial_retention":"all-raw-trials","warmup_runs":null},{"concurrency":null,"fixture_digest":null,"gate_id":"C-PERF-DISK","invalidation_policy":"record-and-rerun-complete-trial-set","operation":"concurrent-disk-governor","repetitions":null,"resource_limits":{"cpu_millicores":null,"disk_bytes":null,"memory_bytes":null},"runner_class":null,"tool_digests":[],"trial_retention":"all-raw-trials","warmup_runs":null},{"concurrency":null,"fixture_digest":null,"gate_id":"C-PERF-RESOLVER","invalidation_policy":"record-and-rerun-complete-trial-set","operation":"mixed-resolution-corpus","repetitions":null,"resource_limits":{"cpu_millicores":null,"disk_bytes":null,"memory_bytes":null},"runner_class":null,"tool_digests":[],"trial_retention":"all-raw-trials","warmup_runs":null},{"concurrency":null,"fixture_digest":null,"gate_id":"C-PERF-PHASE-FAIRNESS","invalidation_policy":"record-and-rerun-complete-trial-set","operation":"phase-fairness","repetitions":null,"resource_limits":{"cpu_millicores":null,"disk_bytes":null,"memory_bytes":null},"runner_class":null,"tool_digests":[],"trial_retention":"all-raw-trials","warmup_runs":null}],"release":"0.3.10","schema_version":"quarry.threshold-benchmark-manifest.v1","thresholds":[{"baseline_digest":null,"class":"absolute","gate_id":"B-HERMETIC-ALL","limit":null,"metric":"unexpected_outcomes","operator":"at_most","statistic":"maximum","unit":"count"},{"baseline_digest":null,"class":"absolute","gate_id":"B-QUALITY","limit":null,"metric":"quality_violations","operator":"at_most","statistic":"maximum","unit":"count"},{"baseline_digest":null,"class":"absolute","gate_id":"B-COVERAGE","limit":null,"metric":"line_coverage","operator":"at_least","statistic":"minimum","unit":"basis_points"},{"baseline_digest":null,"class":"regression","gate_id":"B-COVERAGE","limit":null,"metric":"line_coverage_loss","operator":"at_most","statistic":"maximum","unit":"basis_points"},{"baseline_digest":null,"class":"absolute","gate_id":"B-STATIC-SECURITY","limit":null,"metric":"unsuppressed_findings","operator":"at_most","statistic":"maximum","unit":"count"},{"baseline_digest":null,"class":"absolute","gate_id":"B-DETERMINISM","limit":null,"metric":"artifact_differences","operator":"at_most","statistic":"maximum","unit":"count"},{"baseline_digest":null,"class":"absolute","gate_id":"C-VULNERABILITY","limit":null,"metric":"unaccepted_findings","operator":"at_most","statistic":"maximum","unit":"count"},{"baseline_digest":null,"class":"absolute","gate_id":"C-PERF-RUNNER","limit":null,"metric":"peak_aggregate_rss","operator":"at_most","statistic":"p95","unit":"bytes"},{"baseline_digest":null,"class":"absolute","gate_id":"C-PERF-RUNNER","limit":null,"metric":"wall_deadline","operator":"at_most","statistic":"maximum","unit":"milliseconds"},{"baseline_digest":null,"class":"absolute","gate_id":"C-PERF-RUNNER","limit":null,"metric":"disk_bytes","operator":"at_most","statistic":"p95","unit":"bytes"},{"baseline_digest":null,"class":"absolute","gate_id":"C-PERF-RUNNER","limit":null,"metric":"leaked_fds","operator":"at_most","statistic":"maximum","unit":"count"},{"baseline_digest":null,"class":"absolute","gate_id":"C-PERF-RUNNER","limit":null,"metric":"leaked_processes","operator":"at_most","statistic":"maximum","unit":"count"},{"baseline_digest":null,"class":"absolute","gate_id":"C-PERF-RUNNER","limit":null,"metric":"evidence_byte_mismatches","operator":"at_most","statistic":"maximum","unit":"count"},{"baseline_digest":null,"class":"regression","gate_id":"C-PERF-RUNNER","limit":null,"metric":"wall_time_delta","operator":"at_most","statistic":"median","unit":"basis_points"},{"baseline_digest":null,"class":"absolute","gate_id":"C-PERF-INGEST","limit":null,"metric":"peak_aggregate_rss","operator":"at_most","statistic":"p95","unit":"bytes"},{"baseline_digest":null,"class":"absolute","gate_id":"C-PERF-INGEST","limit":null,"metric":"wall_time","operator":"at_most","statistic":"p95","unit":"milliseconds"},{"baseline_digest":null,"class":"absolute","gate_id":"C-PERF-INGEST","limit":null,"metric":"write_amplification","operator":"at_most","statistic":"maximum","unit":"basis_points"},{"baseline_digest":null,"class":"absolute","gate_id":"C-PERF-INGEST","limit":null,"metric":"disk_growth","operator":"at_most","statistic":"maximum","unit":"bytes"},{"baseline_digest":null,"class":"absolute","gate_id":"C-PERF-INGEST","limit":null,"metric":"refused_remainders","operator":"at_most","statistic":"maximum","unit":"count"},{"baseline_digest":null,"class":"regression","gate_id":"C-PERF-INGEST","limit":null,"metric":"wall_time_delta","operator":"at_most","statistic":"median","unit":"basis_points"},{"baseline_digest":null,"class":"absolute","gate_id":"C-PERF-REPORT","limit":null,"metric":"peak_aggregate_rss","operator":"at_most","statistic":"p95","unit":"bytes"},{"baseline_digest":null,"class":"absolute","gate_id":"C-PERF-REPORT","limit":null,"metric":"artifact_size","operator":"at_most","statistic":"maximum","unit":"bytes"},{"baseline_digest":null,"class":"absolute","gate_id":"C-PERF-REPORT","limit":null,"metric":"wall_time","operator":"at_most","statistic":"p95","unit":"milliseconds"},{"baseline_digest":null,"class":"absolute","gate_id":"C-PERF-REPORT","limit":null,"metric":"artifact_differences","operator":"at_most","statistic":"maximum","unit":"count"},{"baseline_digest":null,"class":"absolute","gate_id":"C-PERF-REPORT","limit":null,"metric":"observation_coverage","operator":"at_least","statistic":"minimum","unit":"basis_points"},{"baseline_digest":null,"class":"regression","gate_id":"C-PERF-REPORT","limit":null,"metric":"wall_time_delta","operator":"at_most","statistic":"median","unit":"basis_points"},{"baseline_digest":null,"class":"absolute","gate_id":"C-PERF-CAMPAIGN","limit":null,"metric":"peak_aggregate_rss","operator":"at_most","statistic":"p95","unit":"bytes"},{"baseline_digest":null,"class":"absolute","gate_id":"C-PERF-CAMPAIGN","limit":null,"metric":"peak_disk","operator":"at_most","statistic":"p95","unit":"bytes"},{"baseline_digest":null,"class":"absolute","gate_id":"C-PERF-CAMPAIGN","limit":null,"metric":"decision_latency","operator":"at_most","statistic":"p95","unit":"milliseconds"},{"baseline_digest":null,"class":"absolute","gate_id":"C-PERF-CAMPAIGN","limit":null,"metric":"full_corpus_duplications","operator":"at_most","statistic":"maximum","unit":"count"},{"baseline_digest":null,"class":"regression","gate_id":"C-PERF-CAMPAIGN","limit":null,"metric":"decision_latency_delta","operator":"at_most","statistic":"median","unit":"basis_points"},{"baseline_digest":null,"class":"absolute","gate_id":"C-PERF-DISK","limit":null,"metric":"reserve_overshoot","operator":"at_most","statistic":"maximum","unit":"bytes"},{"baseline_digest":null,"class":"absolute","gate_id":"C-PERF-DISK","limit":null,"metric":"fairness","operator":"at_least","statistic":"minimum","unit":"basis_points"},{"baseline_digest":null,"class":"absolute","gate_id":"C-PERF-DISK","limit":null,"metric":"destination_corruptions","operator":"at_most","statistic":"maximum","unit":"count"},{"baseline_digest":null,"class":"absolute","gate_id":"C-PERF-DISK","limit":null,"metric":"lost_reservations","operator":"at_most","statistic":"maximum","unit":"count"},{"baseline_digest":null,"class":"regression","gate_id":"C-PERF-DISK","limit":null,"metric":"throughput_delta","operator":"at_most","statistic":"median","unit":"basis_points"},{"baseline_digest":null,"class":"absolute","gate_id":"C-PERF-RESOLVER","limit":null,"metric":"corpus_deadline","operator":"at_most","statistic":"maximum","unit":"milliseconds"},{"baseline_digest":null,"class":"absolute","gate_id":"C-PERF-RESOLVER","limit":null,"metric":"worker_processes","operator":"at_most","statistic":"maximum","unit":"count"},{"baseline_digest":null,"class":"absolute","gate_id":"C-PERF-RESOLVER","limit":null,"metric":"outstanding_queue","operator":"at_most","statistic":"maximum","unit":"count"},{"baseline_digest":null,"class":"absolute","gate_id":"C-PERF-RESOLVER","limit":null,"metric":"lost_remainders","operator":"at_most","statistic":"maximum","unit":"count"},{"baseline_digest":null,"class":"absolute","gate_id":"C-PERF-RESOLVER","limit":null,"metric":"late_mutations","operator":"at_most","statistic":"maximum","unit":"count"},{"baseline_digest":null,"class":"regression","gate_id":"C-PERF-RESOLVER","limit":null,"metric":"deadline_delta","operator":"at_most","statistic":"median","unit":"basis_points"},{"baseline_digest":null,"class":"absolute","gate_id":"C-PERF-PHASE-FAIRNESS","limit":null,"metric":"terminal_obligations","operator":"at_least","statistic":"minimum","unit":"count"},{"basel